survey_id,employee_id,motivation_level,comments,survey_date
1,1,6,Full anything Mrs wife stage reflect between.,2024-02-19
2,1,5,Financial man arm common section.,2024-04-28
3,1,10,Rich trade field.,2024-06-06
4,2,2,Scene half trade top wonder away everything.,2024-02-24
5,2,8,Drop enter particularly have issue cup.,2024-01-24
6,3,3,Field rate opportunity focus.,2024-05-16
7,3,7,Something woman throw everything stay what area.,2024-03-02
8,3,3,Mean evening number soon various.,2024-03-22
9,4,7,Center region million determine character quite doctor.,2024-03-17
10,5,6,World eat responsibility.,2024-01-08
11,6,7,Sister wide discover help trial research receive.,2024-05-06
12,6,10,Well TV marriage writer woman around career.,2024-05-16
13,7,9,Contain enter technology positive.,2024-06-06
14,7,3,Meeting imagine choice crime time change above.,2024-03-01
15,7,3,Ready development save total one message skill surface.,2024-01-11
16,8,7,Amount light consumer expert.,2024-02-03
17,8,10,Close more fine important.,2024-01-09
18,8,4,Tough open election whole officer believe service outside.,2024-02-18
19,9,5,Describe west science Congress feeling since guy argue.,2024-01-28
20,9,4,Ago suddenly president small.,2024-05-22
21,9,3,Travel fish course hospital.,2024-03-20
22,10,2,Sea week fight process read yard.,2024-04-29
23,11,5,Side military economic environmental between.,2024-05-08
24,12,3,Blue defense me economy line.,2024-04-23
25,12,3,Writer check minute decision.,2024-02-07
26,12,7,Education strong finally few near risk pass.,2024-01-23
27,13,2,Rise cold natural trial him.,2024-05-14
28,13,9,Year physical move seat skin.,2024-03-10
29,14,2,Skin of rule civil strong practice.,2024-01-25
30,14,3,Heavy such American our.,2024-03-22
31,14,3,Poor political act best.,2024-02-17
32,15,2,Sing memory court husband win.,2024-04-08
33,16,1,Effort stop possible imagine president of.,2024-03-06
34,17,9,Possible grow can ball skill politics.,2024-02-24
35,17,7,Shake recently rather relate try.,2024-05-20
36,18,5,Out college crime leave your poor continue.,2024-03-30
37,18,3,Democrat actually product place long thing.,2024-06-04
38,18,5,Himself miss standard democratic.,2024-03-24
39,19,7,Animal get follow for share.,2024-05-14
40,19,4,Professional close life rule describe second.,2024-05-19
41,20,2,Wonder fast turn order hold mission.,2024-04-22
42,21,6,According civil shake bar.,2024-03-15
43,22,2,Safe indicate prevent.,2024-05-12
44,22,4,Leg myself allow charge subject.,2024-01-09
45,23,3,Put assume professional space sister attack start.,2024-03-05
46,24,10,Challenge trouble how manage nothing.,2024-05-13
47,24,6,Never offer traditional voice.,2024-06-08
48,24,9,Seven together will price democratic how.,2024-04-22
49,25,9,From suffer turn scene.,2024-01-18
50,26,9,Successful pull full per.,2024-05-08
51,26,2,Hand whole three no enter.,2024-01-05
52,27,8,Police rule politics growth into house.,2024-02-10
53,27,4,What whom outside head when despite but.,2024-01-04
54,27,4,Rock person sister once.,2024-01-24
55,28,8,Grow red politics rate baby.,2024-02-05
56,28,2,Sign page fact require share above service.,2024-04-06
57,28,4,Also activity choose image campaign less.,2024-01-13
58,29,9,Next believe raise nature.,2024-05-26
59,29,7,Audience specific parent color relate.,2024-02-18
60,29,2,Rule hundred particular development give fine east staff.,2024-03-31
61,30,1,Particularly size peace card.,2024-04-03
62,30,8,Indeed anyone doctor investment mother.,2024-03-07
63,31,7,City partner political.,2024-01-29
64,31,6,Lot hot she everyone.,2024-03-01
65,32,9,Ten task change know task whose trip.,2024-04-12
66,32,8,My minute state main.,2024-04-11
67,33,1,Newspaper report responsibility lot our other.,2024-04-01
68,33,2,Research involve cup protect even doctor well.,2024-01-16
69,33,1,Same relationship charge crime Mrs bank reason.,2024-01-17
70,34,4,Today although maintain scene its behavior.,2024-01-28
71,34,7,Ago southern line south sort.,2024-04-06
72,34,4,Eye water even color hour into.,2024-01-09
73,35,8,Board station college everybody may reveal develop.,2024-02-24
74,35,6,Home green social little theory dream artist.,2024-04-22
75,35,5,Beyond your general avoid down.,2024-05-21
76,36,10,Set about four else.,2024-03-11
77,36,7,Low key majority.,2024-05-13
78,37,8,Indicate very three for business.,2024-03-17
79,37,6,Over whole special heart mouth expect.,2024-05-07
80,37,8,Least wall fish truth religious usually.,2024-05-22
81,38,6,Through enter Congress check medical.,2024-02-17
82,39,1,Recognize TV avoid project industry.,2024-05-17
83,40,2,Common image pressure better.,2024-01-04
84,40,6,Couple inside deal material just drug.,2024-05-04
85,41,6,Information consider dark understand sell ten.,2024-05-18
86,41,9,Under industry process adult relate set.,2024-02-01
87,41,7,Model own go.,2024-01-17
88,42,7,Full class would station job.,2024-03-20
89,42,5,Statement name in memory economy be.,2024-05-09
90,43,9,Form knowledge person tax part hour oil.,2024-05-31
91,43,6,Close family within air.,2024-05-31
92,44,8,Author dream could move player open.,2024-05-03
93,44,1,From consider actually woman option.,2024-02-15
94,45,7,Garden personal reach knowledge.,2024-03-16
95,46,6,Paper senior first building have guy simple.,2024-04-29
96,47,8,Attention star but can.,2024-04-25
97,47,2,Herself since human weight let drive reduce.,2024-04-28
98,48,1,Structure glass feeling consider real where company statement.,2024-01-01
99,49,2,Future garden agency leg international choose.,2024-01-04
100,49,4,Another yes century customer.,2024-06-10
101,49,3,Live at short benefit reveal rate bed class.,2024-02-27
102,50,6,President or wall.,2024-04-17
103,50,8,Situation reach themselves home three far near.,2024-06-04
104,50,4,Nice Congress she street through.,2024-03-20
105,51,8,Actually realize market himself take bit.,2024-04-25
106,51,1,Can medical perform end peace box.,2024-05-12
107,51,3,Local blue consider car trip.,2024-05-14
108,52,6,Life young star.,2024-03-04
109,52,8,Power determine third.,2024-05-15
110,53,8,Unit one sure young sit safe only fly.,2024-01-08
111,53,1,Seven shake act very beyond later economy second.,2024-03-17
112,53,5,White tend alone create realize health.,2024-05-10
113,54,6,Coach learn process.,2024-05-19
114,55,4,Only writer difference animal push national.,2024-03-12
115,55,7,Drug follow share behavior boy talk room.,2024-01-17
116,56,6,Structure put rock box author ball use stage.,2024-01-17
117,56,7,For professor however partner party four lawyer live.,2024-02-09
118,56,7,General enough assume occur increase.,2024-04-04
119,57,8,Create after message charge remain.,2024-03-05
120,57,3,Those free remain evidence.,2024-04-27
121,57,7,Scene break only than might talk spring same.,2024-02-18
122,58,5,During yes fund new call lose administration play.,2024-04-03
123,58,10,Meet concern south player parent firm.,2024-01-17
124,59,9,Floor new news small.,2024-02-08
125,60,5,Soldier turn society easy approach activity tonight.,2024-04-30
126,60,6,Fast face marriage increase pick.,2024-03-09
127,61,4,East long agent that list often kind.,2024-02-06
128,61,6,Might how focus.,2024-04-11
129,62,2,Work explain everybody near partner red agency.,2024-03-06
130,62,10,Similar Congress possible.,2024-02-15
131,63,1,Rock possible poor network center pressure cause recognize.,2024-01-02
132,63,10,Make town after cost.,2024-05-08
133,63,10,Audience star another agreement large.,2024-01-28
134,64,6,Soldier sometimes difference even people executive charge.,2024-02-08
135,64,5,Drug growth pull push.,2024-02-17
136,65,2,Cold them red minute we history.,2024-06-09
137,65,3,Painting piece begin newspaper themselves.,2024-01-20
138,66,4,Compare away once.,2024-03-09
139,66,2,Back professional night anyone especially morning around.,2024-02-14
140,67,9,House result help daughter.,2024-05-14
141,67,3,Type much bed movement mention remain.,2024-03-20
142,67,10,Surface small thought best.,2024-03-14
143,68,3,Well street need issue energy blue hospital.,2024-03-19
144,68,7,Class huge cover.,2024-04-17
145,68,2,Standard fire ahead forward thus state.,2024-06-07
146,69,10,Happy pick describe door street.,2024-01-21
147,70,3,Thus whole travel director reduce.,2024-05-13
148,70,8,Reach politics push tax west eat free.,2024-03-24
149,70,2,Your government wall public bill technology.,2024-03-18
150,71,4,Scene system north trial across surface.,2024-03-16
151,71,8,Site thank next focus three.,2024-01-12
152,72,5,Chance enjoy within name care.,2024-04-12
153,72,4,Face water cup fly song begin.,2024-05-21
154,73,4,Try near lose during direction long.,2024-05-25
155,73,4,Oil participant in story reason know recognize.,2024-01-10
156,73,6,Year catch play here activity prove.,2024-03-24
157,74,3,Exist special that resource site design study.,2024-04-08
158,74,8,Magazine hour put case attention.,2024-06-10
159,74,5,Here wear important work.,2024-05-28
160,75,7,Candidate compare people.,2024-05-08
161,75,3,Particular perhaps peace down.,2024-03-13
162,76,3,Lawyer true your line Congress anything.,2024-06-03
163,77,4,Collection increase manager several pass recently pattern.,2024-01-25
164,78,8,Better threat business.,2024-06-04
165,78,4,Author next team part body color would.,2024-01-18
166,79,7,Drop month it.,2024-01-16
167,80,3,Line wide whatever phone no Congress phone.,2024-05-26
168,80,3,Project city item window side option huge.,2024-04-16
169,81,5,Feel determine together relationship.,2024-03-11
170,81,8,Mind PM prevent simply at.,2024-05-16
171,82,7,Price technology American surface size financial.,2024-06-01
172,83,1,Office sense customer role debate challenge.,2024-01-09
173,83,6,Against before point center free support concern.,2024-03-27
174,84,5,Or determine student expert final.,2024-05-30
175,85,2,End start fund race lawyer decade little.,2024-05-28
176,85,5,Strong sell full green quite power.,2024-01-11
177,85,1,Big interview organization myself benefit radio which.,2024-05-22
178,86,4,Language modern note soon.,2024-04-10
179,87,3,Car still seem himself style.,2024-04-21
180,87,2,Treatment voice open game study southern office.,2024-05-21
181,88,5,Nice center wall administration out people special.,2024-05-12
182,88,1,Cup hit kitchen walk whatever.,2024-06-08
183,88,10,Power debate buy campaign approach then.,2024-03-23
184,89,10,Brother character guy easy during customer true.,2024-02-19
185,89,1,One station guess attorney moment wall computer of.,2024-03-13
186,90,5,Significant garden outside them and Mrs dark government.,2024-05-08
187,91,7,By cover notice build particularly rest.,2024-04-25
188,91,6,All strategy real mission make affect opportunity.,2024-01-24
189,92,9,Religious these evidence start.,2024-02-16
190,92,9,Exist year put sit tough.,2024-01-23
191,93,7,Evidence again degree need together author hard.,2024-02-23
192,93,10,Prove quickly threat experience away wonder.,2024-04-11
193,94,10,Foot including box rest enter know campaign.,2024-06-01
194,94,7,Once space protect believe mean everyone.,2024-02-24
195,94,7,Total stock cover arm.,2024-03-24
196,95,3,Well whatever tell bad lawyer in.,2024-02-18
197,95,5,Television present final card large away recent the.,2024-05-12
198,95,1,Collection to memory degree.,2024-02-08
199,96,8,Smile position authority key them.,2024-04-13
200,97,10,There bank reduce including development way through.,2024-05-03
201,98,5,Full while tough door wonder eight.,2024-02-17
202,98,6,Light take hair.,2024-03-11
203,99,5,Vote none others bag.,2024-02-16
204,100,1,Head hair open grow require.,2024-04-19
205,100,7,Different benefit husband health.,2024-05-27
206,100,6,Article lawyer family how long ground.,2024-04-22
